company_name,sector,funding,funding_citation,ai_enabled
guangzhou aige biotechnology co ltd,Not Found,Not Found,Not Found,Unknown
guangzhou aobo pharmaceutical technology co ltd,Others,Not Found,Not Found,Yes
guangzhou baiyunshan chen li ji pharmaceutical factory co ltd,Pharmaceuticals,Not Found,Not Found,No
guangzhou baiyunshan guanghua pharmaceutical co ltd,Pharmaceuticals,Not Found,Not Found,No
guangzhou baiyunshan mingxing pharmaceutical co ltd,Pharmaceuticals,Not Found,Not Found,No
guangzhou baiyunshan pharmaceutical general factory,Not Found,Not Found,Not Found,Unknown
guangzhou baiyunshan pharmaceutical holdings co ltd,Pharmaceuticals,Not Found,Not Found,Yes
guangzhou baiyunshan tianxin pharmaceutical co ltd,Pharmaceuticals,Not Found,Not Found,No
guangzhou baiyunshan zhongyi pharmaceutical co ltd,Not Found,Not Found,Not Found,Unknown
guangzhou bebetter medicine technology co ltd,Biotechnology,"$28.05M, Series A",https://www.marketscreener.com/quote/stock/GUANGZHOU-YUEXIU-CAPITAL--6497848/news/Guangzhou-Bebetter-Medicine-Technology-Co-Ltd-announced-that-it-has-received-28-05-million-in-fu-33855420/,No
guangzhou bio-current pharm co ltd,Not Found,Not Found,Not Found,Unknown
guangzhou boji medical & biotechnological co ltd,Biotechnology,Not Found,Not Found,No
guangzhou brightintel biotech co ltd,Biotechnology,Not Found,Not Found,Yes
guangzhou cape biological technology co ltd,Biotechnology,Not Found,Not Found,No
guangzhou cellprotek pharmaceutical co ltd,Not Found,Not Found,Not Found,Unknown
guangzhou chest hospital ltd,Not Found,Not Found,Not Found,Unknown
guangzhou daguang pharmaceutical group co ltd,Pharmaceuticals,Not Found,Not Found,Yes
guangzhou diqi pharmaceutical technology co ltd,Pharmaceuticals,Not Found,Not Found,Yes
guangzhou doubllebioproduct co ltd,Biotechnology,Not Found,Not Found,Yes
guangzhou egg biotechnology co ltd,Biotechnology,"$2.74M, Not Found",https://www.newtbdrugs.org/content/guangzhou-egg-biotechnology-co-ltd,No
guangzhou eighth people''s hospital,Healthcare,Not Found,Not Found,No
guangzhou fermion technology co ltd,Biotechnology,Not Found,Not Found,Yes
guangzhou first people s hospital,Others,Not Found,Not Found,No
guangzhou fujitopi pharmaceutical co ltd,Not Found,Not Found,Not Found,Unknown
guangzhou general hospital of guangzhou military command,Others,Not Found,Not Found,No
guangzhou green cross pharmaceutical co ltd,Pharmaceuticals,Not Found,Not Found,No
guangzhou hc pharmaceutical co ltd,Pharmaceuticals,Not Found,Not Found,No
guangzhou henovcom bioscience co ltd,Pharmaceuticals,Not Found,Not Found,No
guangzhou hospital of integrated traditional and western medicine,Others,Not Found,Not Found,No
guangzhou hospital of intergrated chinese and west medicine,Others,Not Found,Not Found,No
guangzhou hospital of traditional chinese medicine,Others,Not Found,Not Found,No
guangzhou huadu district people''s hospital,Others,Not Found,Not Found,Yes
guangzhou huasheng pharmaceutical co ltd,Pharmaceuticals,Not Found,Not Found,No
guangzhou huiyuan pharmaceutical technology co ltd,Pharmaceuticals,Not Found,Not Found,No
guangzhou huizhi successful drug research co ltd,Pharmaceuticals,Not Found,Not Found,No
"guangzhou hurui pharmaceutical technology development co., ltd.",Pharmaceuticals,Not Found,Not Found,No
guangzhou imvin pharmaceutical co ltd,Pharmaceuticals,Not Found,Not Found,Yes
guangzhou institute of dermatology,Pharmaceuticals,"$7.3M, Not Found",Not Found,No
guangzhou institute of microbiology group co ltd,Biotechnology,Not Found,Not Found,No
guangzhou joyo pharma co ltd,Pharmaceuticals,Not Found,Not Found,No
guangzhou jiangzheng pharmaceutical technology co ltd,Pharmaceuticals,Not Found,Not Found,No
guangzhou jiayue pharmaceutical technology co ltd,Pharmaceuticals,Not Found,Not Found,Yes
guangzhou jing xiu tang pharmaceutical co ltd,Not Found,Not Found,Not Found,Unknown
guangzhou jiurui pharmaceutical co ltd,Pharmaceuticals,Not Found,Not Found,No
guangzhou kanghe pharmaceutical co ltd,Pharmaceuticals,Not Found,Not Found,No
guangzhou laboratory,Biotechnology,Not Found,Not Found,Yes
guangzhou lianrui pharmaceutical co ltd,Pharmaceuticals,Not Found,Not Found,Yes
guangzhou liushun biotechnology co ltd,Not Found,Not Found,Not Found,Unknown
guangzhou magpie pharmaceutical co ltd,Pharmaceuticals,"$29.1M, Series B",https://tracxn.com/d/companies/guangzhou-magpie-pharmaceuticals/__n0ID18FEYXuqtUxoMTzDlbvVhMoOAT-J7eK738OCIuA,No
guangzhou medical university brain hospital,Others,Not Found,Not Found,No
guangzhou medical university hospital 6,Others,Not Found,Not Found,No
guangzhou medical university hospital one,Others,Not Found,Not Found,No
guangzhou moxi technology co ltd,Others,Not Found,Not Found,No
guangzhou nanxin pharmaceutical co ltd,Pharmaceuticals,Not Found,Not Found,No
guangzhou novaken pharmaceutical co ltd,Pharmaceuticals,Not Found,Not Found,No
guangzhou ouhua pharmaceutical co ltd,Pharmaceuticals,Not Found,Not Found,No
guangzhou pharmaceutical holdings ltd,Not Found,Not Found,Not Found,Unknown
guangzhou puis pharmaceutical factory ltd,Pharmaceuticals,Not Found,Not Found,No
guangzhou red cross hospital,Others,Not Found,Not Found,No
guangzhou ruianbo pharmaceutical technology co ltd,Pharmaceuticals,Not Found,Not Found,Yes
guangzhou runer ophthalmic biotechnology co ltd,Not Found,Not Found,Not Found,Unknown
guangzhou sport university,Others,Not Found,Not Found,No
guangzhou tonghui pharmaceutical co ltd,Not Found,Not Found,Not Found,Unknown
guangzhou university of chinese medicine,Pharmaceuticals,Not Found,Not Found,No
guangzhou university of chinese medicine hospital 2,Others,Not Found,Not Found,Yes
guangzhou women and children''s medical center liuzhou hospital,Others,Not Found,Not Found,No
guangzhou women and children''s medical center,Not Found,Not Found,Not Found,Unknown
guangzhou yanlord pharmaceutical technology co ltd,Not Found,Not Found,Not Found,Unknown
guangzhou yinming biomedical technology co ltd,Biotechnology,"$50M, Series A",https://bouncewatch.com/explore/startup/-2311,No
guangzhou yipinhong pharmaceutical co ltd,Not Found,Not Found,Not Found,Unknown
guangzhou yudong health pharmaceutical co ltd,Pharmaceuticals,Not Found,Not Found,No
guangzhou yuekang biopharmaceuticals co ltd,Pharmaceuticals,Not Found,Not Found,Yes
guangzhou zhiyi biotechnology co ltd,Not Found,Not Found,Not Found,Unknown
guangzhou zhongyi pharmaceutical co ltd,Pharmaceuticals,Not Found,Not Found,No
guanyun people''s hospital,Others,Not Found,Not Found,No
gudui biopharma technology inc,Biotechnology,Not Found,Not Found,Yes
guerbet sa,Pharmaceuticals,Not Found,Not Found,Yes
guger pharmaceutical (hainan) co ltd,Not Found,Not Found,Not Found,Unknown
guilan university of medical sciences,Others,Not Found,Not Found,No
guilin huaxin pharmaceutical co ltd,Not Found,Not Found,Not Found,Unknown
guilin hwasun pharmaceutical co ltd,Pharmaceuticals,Not Found,Not Found,No
guilin pharmaceutical co ltd,Pharmaceuticals,Not Found,Not Found,No
guiping people''s hospital,Others,Not Found,Not Found,No
guiyang dechangxiang pharmaceutical co ltd,Pharmaceuticals,Not Found,Not Found,No
guiyang medical university,Others,Not Found,Not Found,No
guiyang public health clinical center,Others,Not Found,Not Found,No
guiyang xintian pharmaceutical sock limited company,Not Found,Not Found,Not Found,Unknown
guizhou cancer hospital,Not Found,Not Found,Not Found,Unknown
guizhou fukangren pharmaceutical co ltd,Pharmaceuticals,Not Found,Not Found,No
guizhou greensun pharmaceutical co ltd,Not Found,Not Found,Not Found,Unknown
guizhou inochini technology co ltd,Pharmaceuticals,"$10M, Phase 1",https://synapse.patsnap.com/organization/c4f94b17cc5ade2cda218d80c6d73860,No
guizhou liansheng pharmaceutical co ltd,Pharmaceuticals,Not Found,Not Found,Yes
guizhou medical university cancer hospital,Others,Not Found,Not Found,No
guizhou medical university hospital 2,Not Found,Not Found,Not Found,Unknown
guizhou people''s hospital,Others,Not Found,Not Found,No
guizhou provincial orthopedic hospital,Others,Not Found,Not Found,Yes
guizhou provincial people''s hospital,Others,Not Found,Not Found,No
guizhou ruihe pharmaceutical co ltd,Pharmaceuticals,Not Found,Not Found,Yes
guizhou tian''an pharmaceutical co ltd,Pharmaceuticals,Not Found,Not Found,No
guizhou warmen pharmaceutical co ltd,Pharmaceuticals,Not Found,Not Found,No
guizhou yibai pharmaceutical co ltd,Pharmaceuticals,Not Found,Not Found,No
gujarat adani institute of medical sciences,Others,Not Found,Not Found,No
gujarat ayurved university,Others,Not Found,Not Found,No
gujarat cancer & research institute,Others,Not Found,Not Found,No
gujranwala medical college,Others,Not Found,Not Found,No
gujrat ayurved university,Others,Not Found,Not Found,No
guju pharm co ltd,Not Found,Not Found,Not Found,Unknown
gulbarga institute of medical sciences kalaburgi,Others,Not Found,Not Found,No
gulf medical university,Others,Not Found,Not Found,Yes
guna spa,Pharmaceuticals,Not Found,Not Found,No
gunma liver study group,Pharmaceuticals,Not Found,Not Found,No
gunma university graduate school of medicine,Others,Not Found,Not Found,No
gunma university heavy ion medical center,Others,Not Found,Not Found,No
gunma university hospital,Others,Not Found,Not Found,No
guoyuan sinopharm (guangdong) pharmaceutical group co ltd,Pharmaceuticals,Not Found,Not Found,No
guru gobind singh medical college,Not Found,Not Found,Not Found,Unknown
guru nanak eye center,Not Found,Not Found,Not Found,Unknown
guru nanak eye centre,Others,Not Found,Not Found,No
guru tegh bahadur hospital,Others,Not Found,Not Found,No
gurunanda llc,Others,Not Found,Not Found,Yes
gurukrupas amruta ayurveda llp,Pharmaceuticals,Not Found,Not Found,No
gurukula kangri university,Others,Not Found,Not Found,No
gustave roussy institute,Others,Not Found,Not Found,No
gut-brain axis therapeutics llc,Biotechnology,"$1.42M, Seed",https://tracxn.com/d/companies/gut-brain-axis-therapeutics/__BTbkK1bKAScZPLZ4IVIMrjx529AHNlvkD-Du7uyck_g,No
guthrie clinic,Others,Not Found,Not Found,No
guven hospital,Others,Not Found,Not Found,No
gyeongsang national university changwon hospital,Others,Not Found,Not Found,No
gynecologic oncology associates,Others,Not Found,Not Found,No
gynecologic oncology trial and investigation consortium,Not Found,Not Found,Not Found,Unknown
Gynecological Oncology Center South,Others,Not Found,Not Found,No
gynica,Not Found,Not Found,Not Found,Unknown
gynuity health projects,Others,"$74M, Not Found",https://www.influencewatch.org/non-profit/gynuity-health-projects/,No
h. lee moffitt cancer center & research institute foundation inc,Others,Not Found,Not Found,No
h.a.c. pharma,Pharmaceuticals,Not Found,Not Found,No
h3 biomedicine inc,Biotechnology,"$200M, Acquired",https://www.bionity.com/en/companies/1040474/h3-biomedicine-inc.html,No
hab pharmaceuticals & research ltd,Pharmaceuticals,Not Found,Not Found,No
hal allergy bv,Not Found,Not Found,Not Found,Unknown
han kook shin yak corp,Pharmaceuticals,Not Found,Not Found,No
hbt labs inc,Pharmaceuticals,Not Found,Not Found,No
hc synthetic pharmaceutical co ltd,Not Found,Not Found,Not Found,Unknown
hca florida north florida hospital,Others,Not Found,Not Found,No
hcg cancer centre,Not Found,Not Found,Not Found,Unknown
hcg group of hospitals,Others,Not Found,Not Found,Yes
hcg manavata cancer centre,Others,Not Found,Not Found,Yes
hcmc hospital of dermato venereology,Not Found,Not Found,Not Found,Unknown
hdc laboratory,Biotechnology,Not Found,Not Found,No
helios kliniken gmbh,Others,Not Found,Not Found,No
hermes pharma gmbh,Pharmaceuticals,Not Found,Not Found,No
hitec institute of medical sciences,Not Found,Not Found,Not Found,Unknown
hiv prevention trials network,Others,Not Found,Not Found,No
hk surgical inc,Others,Not Found,Not Found,No
hlb pharmaceutical co ltd,Pharmaceuticals,Not Found,Not Found,No
hlk pharmacin llc,Biotechnology,Not Found,Not Found,Yes
hll lifecare ltd,Pharmaceuticals,"$100K, Not Found",https://www.gatesfoundation.org/about/committed-grants/2014/04/opp1108136,No
hm hospitales,Others,Not Found,Not Found,Yes
hm hospitals,Others,Not Found,Not Found,Yes
hmnc holding gmbh,Biotechnology,"$14.3M, Not Found",https://de.linkedin.com/company/hmnc-brain-health,Yes
hoe pharmaceuticals sdn bhd,Pharmaceuticals,Not Found,Not Found,No
homi la misericordia pediatric hospital foundation,Not Found,Not Found,Not Found,Unknown
hq toronto inc,Others,Not Found,Not Found,No
hrh princess chulabhorn college of medical science,Others,Not Found,Not Found,No
hrh princess maha chakri sirindhorn medical center,Not Found,Not Found,Not Found,Unknown
hsk dr. horst schmidt kliniken gmbh,Not Found,Not Found,Not Found,Unknown
hachinohe city hospital,Not Found,Not Found,Not Found,Unknown
hackensack meridian health inc,Others,"$100M, Not Found",https://en.wikipedia.org/wiki/Hackensack_Meridian_Health,Yes
hackensack meridian health,Not Found,Not Found,Not Found,Unknown
haemato oncology foundation for adults in the netherlands,Others,Not Found,Not Found,No
haga hospital,Others,Not Found,Not Found,Yes
hai phong medical university,Not Found,Not Found,Not Found,Unknown
hai yen eye care,Others,Not Found,Not Found,No
haigang hospital of qinhuangdao,Others,Not Found,Not Found,No
haikou city people''s hospital,Others,Not Found,Not Found,No
haikou pharmaceutical factory co ltd,Pharmaceuticals,Not Found,Not Found,No
hailing pharmaceutical company ltd,Not Found,Not Found,Not Found,Unknown
haimen baiji hongye pharmaceutical technology co ltd,Pharmaceuticals,Not Found,Not Found,No
Hainan Aomeihua Pharmaceutical Co Ltd,Pharmaceuticals,Not Found,Not Found,No
hainan asia pharmaceutical co ltd,Not Found,Not Found,Not Found,Unknown
hainan beikang pharmaceutical technology co ltd,Pharmaceuticals,Not Found,Not Found,No
hainan beite pharmaceutical co ltd,Not Found,Not Found,Not Found,Unknown
hainan bikai pharmaceutical co ltd,Not Found,Not Found,Not Found,Unknown
hainan chang''an international pharmaceutical co ltd,Pharmaceuticals,Not Found,Not Found,No
hainan chengrui biotechnology co ltd,Not Found,Not Found,Not Found,Unknown
hainan general sanyang pharmaceutical co ltd,Pharmaceuticals,Not Found,Not Found,No
hainan guangshengyu pharmaceutical co ltd,Pharmaceuticals,Not Found,Not Found,Yes
hainan haili pharmaceutical co ltd,Not Found,Not Found,Not Found,Unknown
hainan hailing chemipharma corporation ltd,Pharmaceuticals,Not Found,Not Found,Yes
hainan hailing chemipharma pharmaceutical corp ltd,Not Found,Not Found,Not Found,Unknown
hainan haishen pharmaceutical co ltd,Not Found,Not Found,Not Found,Unknown
hainan haiyao co ltd,Pharmaceuticals,Not Found,Not Found,No
hainan herui pharmaceutical co ltd,Pharmaceuticals,Not Found,Not Found,No
hainan hishen pharmaceutical group co ltd,Pharmaceuticals,Not Found,Not Found,No
hainan hualon pharmaceutical co ltd,Pharmaceuticals,Not Found,Not Found,No
hainan huanglong pharmaceutical co ltd,Pharmaceuticals,Not Found,Not Found,No
hainan huayi pharmaceutical co ltd,Pharmaceuticals,Not Found,Not Found,No
hainan huitong biopharmaceutical technology co ltd,Pharmaceuticals,Not Found,Not Found,No
hainan huiyuantang pharmaceutical co ltd,Pharmaceuticals,Not Found,Not Found,No
hainan huluwa pharmaceutical group co ltd,Pharmaceuticals,Not Found,Not Found,No
hainan jin rui pharmaceutical co ltd,Pharmaceuticals,Not Found,Not Found,No
hainan jinruibao pharmaceutical technology co ltd,Pharmaceuticals,Not Found,Not Found,No
hainan kangzhe skinhealth technology co ltd,Pharmaceuticals,Not Found,Not Found,No
hainan kejin pharmaceutical co ltd,Pharmaceuticals,Not Found,Not Found,No
hainan kelaiwei pharmaceutical co ltd,Pharmaceuticals,Not Found,Not Found,No
hainan linheng pharmaceutical co ltd,Not Found,Not Found,Not Found,Unknown
hainan medical college,Others,Not Found,Not Found,No
hainan medical college hospital 1,Others,Not Found,Not Found,No
hainan meikangda pharmaceutical co ltd,Pharmaceuticals,Not Found,Not Found,No
hainan meilekang pharmaceutical co ltd,Not Found,Not Found,Not Found,Unknown
hainan miaoyinchun pharmaceutical co ltd,Pharmaceuticals,Not Found,Not Found,No
hainan nuoen biotechnology co ltd,Biotechnology,Not Found,Not Found,No
hainan people''s hospital,Others,Not Found,Not Found,No
hainan poly pharm co ltd,Not Found,Not Found,Not Found,Unknown
hainan provincial hospital of traditional chinese medicine,Not Found,Not Found,Not Found,Unknown
hainan quanxing pharmaceutical co ltd,Pharmaceuticals,Not Found,Not Found,No
hainan quanying pharmaceutical co ltd,Not Found,Not Found,Not Found,Unknown
hainan rizhongtian pharmaceutical co ltd,Not Found,Not Found,Not Found,Unknown
hainan star pharmaceutical co ltd,Pharmaceuticals,Not Found,Not Found,No
hainan saike pharmaceutical co ltd,Pharmaceuticals,Not Found,Not Found,Yes
hainan sanye pharmaceutical co ltd,Pharmaceuticals,Not Found,Not Found,No
hainan selection pharmaceutical co ltd,Pharmaceuticals,Not Found,Not Found,No
hainan sellick pharmaceutical co ltd,Pharmaceuticals,Not Found,Not Found,No
hainan visum pharmaceutical co ltd,Not Found,Not Found,Not Found,Unknown
hainan wanwei pharmaceutical co ltd,Pharmaceuticals,Not Found,Not Found,Yes
hainan weikang pharmaceutical (qianshan) co ltd,Not Found,Not Found,Not Found,Unknown
hainan yaoguyun biotechnology co ltd,Biotechnology,Not Found,Not Found,No
hainan yingda runze pharmaceutical co ltd,Pharmaceuticals,Not Found,Not Found,No
hainan yuanying pharmaceutical technology co ltd,Not Found,Not Found,Not Found,Unknown
hainan zhonghe pharmaceutical co ltd,Pharmaceuticals,Not Found,Not Found,Yes
hainan zhongwang medical technology development co ltd,Not Found,Not Found,Not Found,Unknown
hainan zhuoli pharmaceutical co ltd,Not Found,Not Found,Not Found,Unknown
hainan zhuotai pharmaceutical co ltd,Not Found,Not Found,Not Found,Unknown
haining people''s hospital of zhejiang province,Not Found,Not Found,Not Found,Unknown
haitian group for the study of kaposi''s sarcoma and opportunistic infections,Not Found,Not Found,Not Found,Unknown
hakim pharmaceutical co,Pharmaceuticals,Not Found,Not Found,No
hakodate municipal hospital,Others,Not Found,Not Found,No
hakodate orthopedic clinic,Others,Not Found,Not Found,No
halda therapeutics llc,Not Found,Not Found,Not Found,Unknown
haldia institute of dental sciences & research,Others,Not Found,Not Found,No
haleon plc,Not Found,Not Found,Not Found,Unknown
halia therapeutics inc,Biotechnology,"$336.8K, Series Unknown",https://www.linkedin.com/company/halia-therapeutics-inc,Yes
hallym university kandong sacred heart hospital,Others,Not Found,Not Found,No
hallym university kangnam sacred heart hospital,Others,Not Found,Not Found,Yes
hallym university medical center,Not Found,Not Found,Not Found,Unknown
hallym university sacred heart hospital,Others,"$31.2M, Not Found",https://www.hallym.ac.kr/bbs/iao/1101/361598/artclView.do?layout=unknown,Yes
halmstad university,Others,Not Found,Not Found,Yes
halucenex life sciences inc,Not Found,Not Found,Not Found,Unknown
hamamatsu university,Others,Not Found,Not Found,No
hamdard institute of medical science and research,Others,Not Found,Not Found,No
hamdard university,Others,Not Found,Not Found,No
hamidia hospital,Others,Not Found,Not Found,No
hamlet biopharma ab,Pharmaceuticals,Not Found,Not Found,No
hamlet pharma ab,Not Found,Not Found,Not Found,Unknown
han wha pharma co ltd,Pharmaceuticals,Not Found,Not Found,Yes
hana pharm co ltd,Pharmaceuticals,Not Found,Not Found,Yes
handan central hospital,Others,Not Found,Not Found,No
handan pharmaceutical co ltd,Not Found,Not Found,Not Found,Unknown
hangzhou acea pharmaceutical research co ltd,Not Found,Not Found,Not Found,Unknown
hangzhou adamerck pharmlabs inc,Pharmaceuticals,Not Found,Not Found,No
hangzhou aidecheng pharmaceutical technology co ltd,Pharmaceuticals,Not Found,Not Found,No
hangzhou baicheng pharmaceutical technology co ltd,Not Found,Not Found,Not Found,Unknown
hangzhou bangshun pharmaceutical co ltd,Pharmaceuticals,"$10M, Series C",https://www.cbinsights.com/company/bangshun-pharmaceutical,Yes
hangzhou bio-sincerity pharma-tech co ltd,Pharmaceuticals,Not Found,Not Found,Yes
hangzhou chance pharmaceuticals,Biotechnology,"$10M, Series A",https://synapse.patsnap.com/organization/1993ca9f51daf14bbec67e3275b91c49,No
hangzhou changxi pharmaceutical co ltd,Not Found,Not Found,Not Found,Unknown
hangzhou duanben pharmaceutical technology co ltd,Not Found,Not Found,Not Found,Unknown
hangzhou east china pharmaceutical group co ltd,Not Found,Not Found,Not Found,Unknown
hangzhou fuyang traditional chinese medicine orthopedics hospital,Not Found,Not Found,Not Found,Unknown
hangzhou gaotian biological medicine co ltd,Biotechnology,Not Found,Not Found,Yes
hangzhou guoguang pharmaceutical co ltd,Pharmaceuticals,Not Found,Not Found,Yes
hangzhou hekang pharmaceutical co ltd,Not Found,Not Found,Not Found,Unknown
hangzhou heze pharmaceutical technology co ltd,Pharmaceuticals,Not Found,Not Found,Yes
hangzhou hezheng pharmaceutical co ltd,Pharmaceuticals,Not Found,Not Found,Yes
hangzhou highlightll pharmaceutical co ltd,Pharmaceuticals,Not Found,Not Found,Yes
hangzhou hongyou pharmaceutical technology co ltd,Pharmaceuticals,Not Found,Not Found,Yes
hangzhou hospital of traditional chinese medicine,Others,Not Found,Not Found,No
"hangzhou huadong medicine group kangrun pharmaceutical co., ltd.",Not Found,Not Found,Not Found,Unknown
hangzhou huadong pharmaceutical group new drug research institute co ltd,Pharmaceuticals,Not Found,Not Found,No
hangzhou huadong pharmaceutical group zhejiang huayi pharmaceutical co ltd,Pharmaceuticals,Not Found,Not Found,No
hangzhou huang sen biotechnology co ltd,Biotechnology,Not Found,Not Found,No
hangzhou huangsen biotechnology co ltd,Biotechnology,Not Found,Not Found,No
hangzhou kangenbei pharmaceutical co ltd,Pharmaceuticals,Not Found,Not Found,No
hangzhou lingji pharmaceutical technology co ltd,Not Found,Not Found,Not Found,Not Found
hangzhou maternity and child health care hospital,Others,Not Found,Not Found,No
hangzhou medical college,Others,Not Found,Not Found,No
hangzhou metai pharmaceutical technology co ltd,Pharmaceuticals,"$300M, Series C",https://trial.medpath.com/news/e1b3b23a08cb31ee/metis-pharmaceuticals-plans-200-million-hong-kong-ipo-to-advance-ai-driven-drug-development,Yes
hangzhou minsheng pharmaceutical group co ltd,Pharmaceuticals,"$10M, IPO",https://www.hzmsjk.com/en/about.html,No
hangzhou minsheng pharmaceutical group co ltd (inactive),Not Found,Not Found,Not Found,Unknown
hangzhou muyuan biomedical technology co ltd,Biotechnology,Not Found,Not Found,No
hangzhou nanyang supor pharmaceutical industry co ltd,Pharmaceuticals,Not Found,Not Found,No
hangzhou normal university,Not Found,Not Found,Not Found,Unknown
hangzhou normal university hospital,Others,Not Found,Not Found,No
hangzhou people''s hospital 1,Others,Not Found,Not Found,Yes
hangzhou qianyuan baoling pharmaceutical co ltd,Not Found,Not Found,Not Found,Unknown
hangzhou red cross hospital,Not Found,Not Found,Not Found,Unknown
hangzhou ruidi biotechnology co ltd,Biotechnology,Not Found,Not Found,No
hangzhou seventh people''s hospital,Others,Not Found,Not Found,No
hangzhou synrx therapeutics co ltd,Biotechnology,"$14.2M, Seed",https://tracxn.com/d/companies/synrx-therapeutics/__H9cn8AaYZUk_YwoCjimSBM1f4el2W19nEEu8aBh5lto,No
hangzhou third hospital,Others,Not Found,Not Found,No
hangzhou third people''s hospital,Not Found,Not Found,Not Found,Unknown
hangzhou vitan pharmaceutical technology co ltd,Pharmaceuticals,Not Found,Not Found,No
hangzhou weiben pharmaceutical co ltd,Pharmaceuticals,Not Found,Not Found,No
hangzhou women''s hospital,Others,Not Found,Not Found,No
hangzhou xianshi biotechnology co ltd,Biotechnology,Not Found,Not Found,No
hangzhou xinbosi biomedicine co ltd,Not Found,Not Found,Not Found,Unknown
hangzhou xixi hospital,Others,Not Found,Not Found,No
hangzhou yunbai pharmaceutical technology co ltd,Pharmaceuticals,Not Found,Not Found,No
hangzhou zede pharmaceutical technology co ltd,Pharmaceuticals,Not Found,Not Found,No
hangzhou zenshine pharmaceuticals co ltd,Not Found,Not Found,Not Found,Unknown
hangzhou zhicheng technology co ltd,Pharmaceuticals,Not Found,Not Found,No
hangzhou zhixing pharmaceutical co ltd,Pharmaceuticals,Not Found,Not Found,Yes
hangzhou zhongmeihuadong pharmaceutical co ltd,Pharmaceuticals,Not Found,Not Found,No
hangzhou zhu yang xin pharmaceutical co ltd,Pharmaceuticals,Not Found,Not Found,No
hanhui pharmaceuticals co ltd,Pharmaceuticals,Not Found,Not Found,Yes
hanlim pharm co ltd,Pharmaceuticals,Not Found,Not Found,No
hannover clinical trial center gmbh,Pharmaceuticals,Not Found,Not Found,No
hannover medical school,Others,Not Found,Not Found,Yes
hanoi medical university,Others,Not Found,Not Found,No
hanoi obstetrics and gynecology hospital,Others,Not Found,Not Found,No
hanpoong pharm and foods co ltd,Not Found,Not Found,Not Found,Unknown
hanpoong pharmaceutical co ltd,Not Found,Not Found,Not Found,Unknown
hanseo hospital,Others,Not Found,Not Found,No
hanshin association of molecular targeted therapy for hcc,Biotechnology,Not Found,Not Found,No
hansung university,Others,Not Found,Not Found,Yes
hanulbnc co ltd,Pharmaceuticals,Not Found,Not Found,No
hanyang university guri hospital,Others,Not Found,Not Found,No
hanyang university seoul hospital,Not Found,Not Found,Not Found,Unknown
hanzhong central hospital,Others,Not Found,Not Found,No
haofang (fujian) biotechnology co ltd,Biotechnology,Not Found,Not Found,No
haoma medica ltd,Biotechnology,Not Found,Not Found,No
harbin huarui biochemical pharmaceutical co ltd,Pharmaceuticals,Not Found,Not Found,No
harbin institute of hematology and oncology,Others,Not Found,Not Found,No
