company_name,sector,funding,funding_citation,ai_enabled
incor health institute,Not Found,Not Found,Not Found,Unknown
incor heart institute,Others,Not Found,Not Found,No
inflectis bioscience sas,Biotechnology,Not Found,Not Found,No
inmed pharmaceuticals inc,Pharmaceuticals,"$5M, Private Placement",https://www.stocktitan.net/news/INM/,No
insilico medicine,Biotechnology,"$255M, Series C",https://en.wikipedia.org/wiki/Insilico_Medicine,Yes
inari medical inc,Others,"$20.9M, Series C",https://www.linkedin.com/company/inari-medical,No
inbiotec,Biotechnology,Not Found,Not Found,No
incannex healthcare ltd,Pharmaceuticals,"$12.5M, Post IPO equity",https://au.linkedin.com/company/impressionhealthcarelimited,No
incozen therapeutics pvt ltd,Biotechnology,Not Found,Not Found,No
incuron,Biotechnology,Not Found,Not Found,No
incyclix bio llc,Biotechnology,"$11.25M, Series B",https://finance.yahoo.com/news/incyclix-bio-secures-11-25-110000925.html,No
independent public clinical hospital no 4 in lublin,Not Found,Not Found,Not Found,Unknown
independent public healthcare center in rypin,Others,Not Found,Not Found,No
indero cro,Biotechnology,Not Found,Not Found,No
inderprastha dental college and hospital,Not Found,Not Found,Not Found,Unknown
indetek laboratory,Not Found,Not Found,Not Found,Unknown
india glycols ltd,Others,Not Found,Not Found,Yes
indian academy of neurology,Others,Not Found,Not Found,No
indian association of dermatologists venereologists and leprologists,Others,Not Found,Not Found,No
indian association of supportive care in cancer,Others,Not Found,Not Found,No
indian council of medical research,Not Found,Not Found,Not Found,Unknown
indian council of social science research,Not Found,Not Found,Not Found,Unknown
indian institute of technology (bhu) varanasi,Others,Not Found,Not Found,No
indian institute of technology madras,Others,Not Found,Not Found,Yes
indian institute of technology mandi,Others,Not Found,Not Found,Yes
"indian institute of technology, kanpur;ganesh shankar vidyarthi memorial medical college",Others,Not Found,Not Found,No
indian rheumatology association,Others,Not Found,Not Found,No
indian society of neuroanaesthesiology and critical care,Others,Not Found,Not Found,No
indiana hand to shoulder center,Others,Not Found,Not Found,No
indiana institute for medical research inc,Others,Not Found,Not Found,No
indiana nanotech llc,Biotechnology,"$1.04M, Not Found",https://www.sbir.gov/portfolio/189604,No
indiana university health goshen hospital,Not Found,Not Found,Not Found,Unknown
indiana university health inc,Not Found,Not Found,Not Found,Unknown
indiana university research & technology corp,Biotechnology,"$10M, Seed",https://iuventures.com/introducing-iu-ventures-the-future-of-iu-innovation/,No
indiana university school of medicine,Others,"$243.6M, Not Found",https://en.wikipedia.org/wiki/Indiana_University_School_of_Medicine,No
indiana university,Not Found,Not Found,Not Found,Unknown
indication bioscience llc,Biotechnology,Not Found,Not Found,Yes
indira gandhi government medical college & hospital,Others,Not Found,Not Found,No
indira gandhi institute of dental sciences,Not Found,Not Found,Not Found,Unknown
indira gandhi institute of medical sciences,Others,Not Found,Not Found,No
indira gandhi medical college,Not Found,Not Found,Not Found,Unknown
indira gandhi medical college and hospital,Others,Not Found,Not Found,No
indivior inc,Pharmaceuticals,"$400M, Post IPO Debt",https://www.linkedin.com/company/indivior,No
indivior plc,Not Found,Not Found,Not Found,Unknown
indo-american spine alliance,Not Found,Not Found,Not Found,Unknown
indoco remedies ltd,Pharmaceuticals,Not Found,Not Found,No
indus biotech pvt ltd,Not Found,Not Found,Not Found,Unknown
industrial farmaceutica cantabria sa,Pharmaceuticals,Not Found,Not Found,No
industrial pharmaceutical company obnovlenie,Pharmaceuticals,Not Found,Not Found,No
ineos healthcare ltd,Others,Not Found,Not Found,No
Inex Pharmaceuticals Corp (inactive),Biotechnology,Not Found,Not Found,No
infan industria quimica farmaceutica nacional s/a,Pharmaceuticals,Not Found,Not Found,Yes
infanta leonor university hospital,Others,Not Found,Not Found,No
infanta sofia university hospital,Others,Not Found,Not Found,Yes
infectex,Pharmaceuticals,Not Found,Not Found,No
infectious diseases institute,Others,Not Found,Not Found,Yes
infectious diseases physicians inc,Others,Not Found,Not Found,No
infectopharm arzneimittel und consilium gmbh,Pharmaceuticals,Not Found,Not Found,No
infilife healthcare pvt ltd,Others,Not Found,Not Found,No
infinitus (china) co ltd,Others,Not Found,Not Found,Yes
"inflabloc pharmaceuticals, inc. (inactive)",Error,Error,Error,Error
inflammx therapeutics inc,Biotechnology,Not Found,Not Found,No
ingenious ingredients lp,Biotechnology,Not Found,Not Found,No
inhalerx ltd,Biotechnology,Not Found,Not Found,No
inhibikase therapeutics inc,Pharmaceuticals,"$110M, IPO",https://www.linkedin.com/company/inhibikase-therapeutics,No
inhibitex llc,Biotechnology,"$2.5B, Acquired",https://drug-dev.com/inhibitex-to-be-acquired-by-bristol-myers-squibb-for-2-5-billion/,No
inhibitor therapeutics inc,Pharmaceuticals,Not Found,Not Found,No
iniciativa andaluza en terapias avanzadas,Biotechnology,"$96.88M, Not Found",https://pmc.ncbi.nlm.nih.gov/articles/PMC3659837/,No
inipharm inc,Biotechnology,Not Found,Not Found,Yes
initiator pharma as,Biotechnology,"$2.1M, Secondary Market",https://www.linkedin.com/company/initiatorpharma.com,No
inje university,Others,Not Found,Not Found,No
inje university busan paik hospital,Others,Not Found,Not Found,No
inje university haeundae paik hospital,Others,Not Found,Not Found,No
inje university ilsan paik hospital,Others,Not Found,Not Found,No
inmunotek sl,Pharmaceuticals,Not Found,Not Found,No
inner mongolia autonomous region people''s hospital,Others,Not Found,Not Found,No
inner mongolia autonomous region people's hospital,Others,Not Found,Not Found,No
inner mongolia baiyi pharmaceutical co ltd,Pharmaceuticals,Not Found,Not Found,No
inner mongolia international mongolian hospital,Others,Not Found,Not Found,No
inner mongolia medical university,Others,Not Found,Not Found,Yes
inner mongolia medical university hospital 2,Others,Not Found,Not Found,Yes
inner mongolia people''s hospital,Others,Not Found,Not Found,No
innomedica holding ag,Pharmaceuticals,Not Found,Not Found,No
innora gmbh,Biotechnology,Not Found,Not Found,No
innoup farma sl,Biotechnology,Not Found,Not Found,Yes
innocoll holdings ltd,Pharmaceuticals,Not Found,Not Found,No
innocrin pharmaceuticals inc (inactive),Pharmaceuticals,Not Found,Not Found,No
innolife co ltd,Biotechnology,Not Found,Not Found,Yes
innopharmax inc,Pharmaceuticals,Not Found,Not Found,No
innovaderm research inc,Pharmaceuticals,Not Found,Not Found,No
innovagyn inc,Pharmaceuticals,"$682,403, Not Found",https://www.sbir.gov/portfolio/820315,No
innovantase research and development services,Others,Not Found,Not Found,Yes
innovation pharmaceuticals inc,Pharmaceuticals,Not Found,Not Found,No
innovative medical products inc,Others,Not Found,Not Found,No
innovative molecules gmbh,Biotechnology,"$21.2M, Series A",https://www.innovativemolecules.com/,No
innovcare lifesciences pvt ltd,Pharmaceuticals,Not Found,Not Found,No
innoviva inc,Biotechnology,Not Found,Not Found,No
innovo therapeutics co ltd,Biotechnology,"$14.1M, Seed",https://www.linkedin.com/company/innovo-therapeutics,Yes
innovo therapeutics inc,Biotechnology,"$14.1M, Seed",https://www.linkedin.com/company/innovo-therapeutics,Yes
inonu university,Others,Not Found,Not Found,No
inova fairfax hospital,Others,Not Found,Not Found,No
inova health care services,Others,Not Found,Not Found,Yes
insight molecular diagnostics inc,Biotechnology,Not Found,Not Found,No
insight therapeutics llc,Pharmaceuticals,Not Found,Not Found,No
inspired life medical inc,Biotechnology,"$5.74M, Seed",https://tracxn.com/d/companies/inspired-life-medical/__pVw_xjOZkpGnCk2gqWFhLprmGghwHiteogzE_s03_uk,Yes
inspirion delivery technologies llc,Pharmaceuticals,Not Found,Not Found,No
institut catala de retina sl,Others,Not Found,Not Found,No
institut du cancer de montpellier,Others,Not Found,Not Found,No
institut investigacio sanitaria pere virgili,Biotechnology,Not Found,Not Found,No
institut national de la sante et de la recherche medicale (inserm),Others,Not Found,Not Found,No
institut ophtalmologique de l ouest jules verne,Others,Not Found,Not Found,Yes
institut pasteur de lille,Biotechnology,Not Found,Not Found,No
institut universitari dexeus,Others,Not Found,Not Found,No
institut de cancerologie d l'ouest,Others,Not Found,Not Found,No
institut de recerca hscsp,Biotechnology,Not Found,Not Found,No
institut de recerca hospital de sant pau,Biotechnology,Not Found,Not Found,No
institut de recherche en sciences de la sante,Others,"$2.06M, Not Found",https://www.gatesfoundation.org/about/committed-grants/2022/06/inv037164,No
institut fur klinisch-kardiovaskulare forschung gmbh,Others,Not Found,Not Found,No
institut fur lebensmittelwissenschaft und humanernahrung,Others,Not Found,Not Found,No
institut fur pharmakologie und praventive medizin gmbh,Pharmaceuticals,Not Found,Not Found,No
institut regional de cancerologie de montpellier,Others,Not Found,Not Found,No
institute allergosan,Biotechnology,Not Found,Not Found,No
institute for respiratory health,Others,Not Found,Not Found,No
institute hospital del mar medical research,Others,Not Found,Not Found,Yes
institute for asthma & allergy pc,Others,Not Found,Not Found,No
institute for cardiovascular diseases of vojvodina,Others,Not Found,Not Found,Yes
institute for clinical pharmacology at the university hospital magdeburg,Pharmaceuticals,Not Found,Not Found,No
institute for clinical research malaysia,Others,Not Found,Not Found,Yes
institute for development research,Error,Error,Error,Error
institute for drug development cancer therapy and research center,Pharmaceuticals,Not Found,Not Found,No
institute for human genetics university hospital heidelberg,Biotechnology,Not Found,Not Found,No
institute for mitochondrial medicine,Others,Not Found,Not Found,No
institute for neurodegenerative disorders,Others,Not Found,Not Found,No
institute for orphan drug discovery,Biotechnology,Not Found,Not Found,No
institute for post graduate teaching & research in ayurveda,Others,Not Found,Not Found,No
"institute for post graduate teaching & research in ayurveda;ministry of ayush, india",Others,Not Found,Not Found,No
institute for research & development,Others,Not Found,Not Found,No
institute for systemic neurosciences,Others,Not Found,Not Found,No
"institute for study, research, education and therapy of vascular, heart, brain and kidney nosologies",Others,Not Found,Not Found,No
institute for the study of urological diseases,Biotechnology,Not Found,Not Found,Yes
institute of basic research in clinical medicine,Pharmaceuticals,Not Found,Not Found,No
institute of biomedical research maimonides of cordoba,Biotechnology,Not Found,Not Found,Yes
institute of biomedical research of malaga,Biotechnology,Not Found,Not Found,No
institute of biomedical technologies,Biotechnology,Not Found,Not Found,Yes
institute of blood transfusion chinese academy of medical sciences,Biotechnology,Not Found,Not Found,No
institute of cancer research,Biotechnology,Not Found,Not Found,Yes
institute of cardiology warsaw,Others,Not Found,Not Found,Yes
institute of child health,Others,Not Found,Not Found,No
"institute of chinese medical history documents, china academy of chinese medical sciences",Others,Not Found,Not Found,Yes
institute of clinical physiology cnr,Others,Not Found,Not Found,No
institute of dental sciences bareilly,Others,Not Found,Not Found,No
institute of dental sciences bhubaneshwar,Others,Not Found,Not Found,No
institute of dental studies and technologies,Others,Not Found,Not Found,No
institute of dermatology chinese academy of medical sciences,Pharmaceuticals,Not Found,Not Found,No
"institute of dermatology chinese academy of medical sciences;hospital for skin diseases, chinese academy of medical sciences;peking union medical college",Others,Not Found,Not Found,No
institute of dermatology,Error,Error,Error,Error
institute of emergency medicine and disaster medicine sichuan people''s hospital,Others,Not Found,Not Found,Yes
institute of gynecology and fertility,Others,Not Found,Not Found,No
institute of hematology & blood diseases hospital,Others,Not Found,Not Found,No
institute of hematology and blood diseases hospital,Biotechnology,Not Found,Not Found,Yes
"institute of materia medica, chinese academy of medical sciences & peking union medical college",Pharmaceuticals,Not Found,Not Found,No
institute of medical assistance to the state public server,Error,Error,Error,Error
institute of medicine and applied epidemiology,Error,Error,Error,Error
institute of mental health,Error,Error,Error,Error
institute of molecular medicine and biomedical research,Others,Not Found,Not Found,No
institute of molecular and translational medicine,Biotechnology,Not Found,Not Found,No
institute of naval medicine,Others,Not Found,Not Found,No
institute of neurosciences kolkata,Others,Not Found,Not Found,No
institute of nuclear medicine & allied sciences,Others,Not Found,Not Found,No
"institute of nutrition and health, chinese center for disease control and prevention",Others,"$450,000, Not Found",https://taggs.hhs.gov/Detail/RecipDetail?arg_EntityId=5fc8UabQf1mLPnTnp4QDTQ%3D%3D,No
institute of oncology and radiology of serbia,Others,Not Found,Not Found,No
institute of pharmacology and toxicology academy of military medical sciences pla,Pharmaceuticals,Not Found,Not Found,No
institute of post graduate medical education and research,Others,Not Found,Not Found,No
institute of post graduate teaching & research in ayurveda,Others,Not Found,Not Found,No
institute of post-graduate ayurvedic education and research,Others,Not Found,Not Found,No
institute of psychiatry (inactive),Others,Not Found,Not Found,No
institute of psychiatry coe,Others,Not Found,Not Found,No
institute of psychiatry and neurology,Others,Not Found,Not Found,No
institute of pulmocare &,Others,Not Found,Not Found,Yes
institute of rheumatology belgrade,Others,Not Found,Not Found,No
institute of science tokyo,Others,Not Found,Not Found,Yes
institute of teaching and research in ayurveda jamnagar,Others,Not Found,Not Found,No
institute of tropical medicine,Others,"$17.5M, Not Found",https://www.itg.be/en,No
institute for oncology hematology and cell therapy,Others,Not Found,Not Found,No
institutional fund from tata memorial centre,Others,"$45.6M, Not Found",https://medicaldialogues.in/news/health/hospital-diagnostics/tata-memorial-centre-to-get-rs-380-crore-nse-funding-for-cancer-facility-156515,Yes
instituto brasileiro de controle do cancer,Others,Not Found,Not Found,No
instituto cardiologico banfield,Others,Not Found,Not Found,No
instituto de prevision social,Others,Not Found,Not Found,No
instituto fernandes figueira,Others,Not Found,Not Found,No
instituto ideia fertil de reproductive health,Others,Not Found,Not Found,No
instituto materno infantil prof fernando figueira,Others,Not Found,Not Found,Yes
instituto murciano de investigacion biosanitaria virgen de la arrixaca,Biotechnology,Not Found,Not Found,No
instituto nacional de enfermedades respiratorias,Others,Not Found,Not Found,No
instituto nacional de perinatologia isidro espinosa de los reyes,Others,Not Found,Not Found,No
instituto nacional de salud publica mexico,Others,Not Found,Not Found,No
instituto neurociencia del dolor,Others,Not Found,Not Found,No
instituto palacios,Others,Not Found,Not Found,No
instituto sailly hospital de saude mental,Others,Not Found,Not Found,No
instituto teofilo hernando,Pharmaceuticals,Not Found,Not Found,No
instituto valenciano de infertilidad,Biotechnology,Not Found,Not Found,No
instituto de investigacion sanitaria la fe,Biotechnology,Not Found,Not Found,Yes
instituto de investigacion sanitaria de santiago de compostela,Biotechnology,Not Found,Not Found,Yes
instituto de ojos,Others,Not Found,Not Found,No
instituto de seguridad y servicios sociales de los trabajadores del estado,Others,Not Found,Not Found,No
instituto de seguros sociales,Others,Not Found,Not Found,No
instytut matki i dziecka,Others,Not Found,Not Found,No
insud pharma,Pharmaceuticals,Not Found,Not Found,No
insud pharma sl,Pharmaceuticals,Not Found,Not Found,No
insys therapeutics inc (inactive),Pharmaceuticals,Not Found,Not Found,No
intekrin therapeutics inc,Biotechnology,"$65.2M, Series C",https://tracxn.com/d/companies/intekrin-therapeutics/__r3-MIoFC6xdY9zkaE2NWMpvRP8sbgrVy3O3grSYrIHw,No
intech biopharm ltd,Pharmaceuticals,"$10M, IPO",https://www.linkedin.com/company/intech-biopharm/,No
integrated cancer treatment and research centre,Others,"$5.25M, Not Found",https://www.ayurvedcollegewagholi.com/cancer_research_centre.html,No
integrated center for health and social services,Others,Not Found,Not Found,No
integrated chinese and western medicine hospital of zhejiang province,Others,Not Found,Not Found,No
integrated clinical research llc,Pharmaceuticals,Not Found,Not Found,No
integrated health service university of udine,Others,Not Found,Not Found,No
integrated management of albacete,Error,Error,Error,Error
integrated university center for health and social services of the north island of montreal,Others,Not Found,Not Found,No
integrated university hospital trust of verona,Others,Not Found,Not Found,Yes
integrative skin science and research,Pharmaceuticals,Not Found,Not Found,No
intelgenx corp,Pharmaceuticals,Not Found,Not Found,No
intelectual dialogue,Others,Not Found,Not Found,No
intermune inc (inactive),Error,Error,Error,Error
intercept pharmaceuticals inc,Pharmaceuticals,"$447.7M, IPO",https://www.linkedin.com/company/intercept-pharmaceuticals,Yes
interdisciplinary crohn''s colitis center,Others,Not Found,Not Found,No
interessenverband zur qualitatssicherung der arbeit niedergelassener uro-onkologen in deutschland ev,Others,Not Found,Not Found,No
interhospital foundation for cardiovascular research,Others,Not Found,Not Found,Yes
intermed sa,Pharmaceuticals,Not Found,Not Found,No
intermountain healthcare inc,Others,Not Found,Not Found,Yes
international agency for research on cancer,Others,Not Found,Not Found,No
international bio service co ltd,Pharmaceuticals,Not Found,Not Found,No
international breast cancer research foundation,Others,Not Found,Not Found,No
international cteph association,Others,Not Found,Not Found,No
international cancer research group,Others,Not Found,Not Found,No
international centre for diarrhoeal disease research bangladesh,Others,"$2M, Not Found","https://en.wikipedia.org/wiki/Icddr,b",No
international collaborative cancer group,Others,Not Found,Not Found,No
international extranodal lymphoma study group,Others,Not Found,Not Found,No
international institute of sleep sciences,Others,Not Found,Not Found,No
international institute of yoga & naturopathy medical sciences,Others,Not Found,Not Found,No
international islamic university islamabad,Others,Not Found,Not Found,No
international islamic university malaysia,Others,Not Found,Not Found,No
international medical center of japan,Others,Not Found,Not Found,No
international medical college and hospital,Others,Not Found,Not Found,No
international medical university,Others,Not Found,Not Found,No
international partnership for microbicides,Pharmaceuticals,"$60M, Grant",https://www.gatesfoundation.org/about/committed-grants/2003/06/opp20988,No
international peace maternity & child health hospital,Others,Not Found,Not Found,No
international peace maternity and child care center,Others,Not Found,Not Found,No
international peace maternity and child health hospital,Others,Not Found,Not Found,No
international union against tuberculosis and lung disease,Others,Not Found,Not Found,No
international union against tuberculosis and lung diseases,Others,"$540M, Not Found",https://www.devex.com/organizations/the-international-union-against-tuberculosis-and-lung-disease-the-union-54174,No
international university for science & technology,Others,Not Found,Not Found,No
international university of catalonia,Others,Not Found,Not Found,No
international vaccine institute,Biotechnology,Not Found,Not Found,Yes
intersect ent inc,Biotechnology,"$30M, Series D",https://en.wikipedia.org/wiki/Intersect_ENT,No
interventional pain and spine center,Others,Not Found,Not Found,No
intezyne inc,Biotechnology,"$10M, Series A",https://www.crunchbase.com/organization/intezyne-technologies,No
intra-cellular therapies inc,Pharmaceuticals,"$14.6B, Acquired",https://www.reuters.com/markets/deals/jj-buy-intra-cellular-therapies-146-billion-2025-01-13/,No
intrabio ltd,Pharmaceuticals,Not Found,Not Found,Yes
intragel therapeutics ltd,Pharmaceuticals,"$20M, Seed",https://www.cbinsights.com/company/intragel-therapeutics,No
intramural research grant university college of medical sciences,Others,Not Found,Not Found,No
intrepid therapeutics inc,Error,Error,Error,Error
intrinsic medicine inc,Biotechnology,Not Found,Not Found,No
intro biopharma co ltd,Pharmaceuticals,Not Found,Not Found,No
inventage lab inc,Biotechnology,Not Found,Not Found,No
inventia healthcare ltd,Pharmaceuticals,"$13.4M, Acquired",https://www.platinumequity.com/news/platinum-equity-acquires-controlling-stake-in-inventia-healthcare/,No
inventiva sa,Biotechnology,"$10M, Post IPO equity",https://www.linkedin.com/company/inventiva-pharma,No
invenux llc,Pharmaceuticals,"$224,731, Seed",https://www.sbir.gov/awards/163290,No
inversago pharma inc,Biotechnology,"$35M, Series B; $70M, Series C",https://forbion.com/news-insights/news/forbion-portfolio-company-inversago-pharma-to-be-acquired-by-novo-nordisk/,No
invicro llc,Biotechnology,Not Found,Not Found,Yes
invion ltd,Biotechnology,Not Found,Not Found,No
invirsa inc,Pharmaceuticals,"$7.7M, Series B",https://www.businesswire.com/news/home/20230614023662/en/Invirsa-Completes-%247.7M-Series-B-Financing,No
invitro research solutions pvt ltd,Biotechnology,Not Found,Not Found,No
inxmed (nanjing) co ltd,Biotechnology,Not Found,Not Found,No
inzpera healthsciences ltd,Pharmaceuticals,Not Found,Not Found,No
io therapeutics inc,Biotechnology,"$4.2M, Series Unknown",https://www.linkedin.com/company/io-therapeutics,Yes
iowa state university,Others,Not Found,Not Found,No
iperboreal pharma srl,Pharmaceuticals,Not Found,Not Found,No
iphytos company tanzania ltd,Pharmaceuticals,Not Found,Not Found,Yes
ipsen bioscience inc,Pharmaceuticals,Not Found,Not Found,No
ipsen pharma sa,Pharmaceuticals,Not Found,Not Found,No
iran daru co,Pharmaceuticals,Not Found,Not Found,No
iran hormone company,Pharmaceuticals,Not Found,Not Found,No
iran hormone pharmaceutical co.,Pharmaceuticals,Not Found,Not Found,No
iran university of medical sciences,Others,Not Found,Not Found,No
irbit chemical-pharmaceutical plant,Pharmaceuticals,Not Found,Not Found,No
irish clinical outcomes in research and education,Others,Not Found,Not Found,No
iroko pharmaceuticals llc,Pharmaceuticals,Not Found,Not Found,No
ironshore pharmaceuticals and development inc,Pharmaceuticals,"$343M, Acquired",https://www.cbinsights.com/company/ironshore-pharmaceuticals-development,No
ironshore therapeutics inc,Pharmaceuticals,"$525M, Acquired",https://businessnc.com/north-carolina-pharma-company-being-sold-for-525-million/,No
irrua specialist teaching hospital,Others,Not Found,Not Found,No
irvin 2,Pharmaceuticals,Not Found,Not Found,No
ise red cross hospital,Others,Not Found,Not Found,No
isfahan university of medical sciences,Others,Not Found,Not Found,Yes
ishan ayurvedic medical college and research centre,Others,Not Found,Not Found,No
islamabad medical and dental college,Others,Not Found,Not Found,No
islamia university of bahawalpur pakistan,Others,Not Found,Not Found,No
islamic azad university khorasgan branch,Others,Not Found,Not Found,Yes
islamic azad university marvdasht,Others,Not Found,Not Found,No
islamic azad university najafabad,Others,Not Found,Not Found,No
islamic azad university pharmaceutical sciences branch,Pharmaceuticals,Not Found,Not Found,No
islamic azad university shahrekord branch,Others,Not Found,Not Found,No
islamic azad university tehran,Others,Not Found,Not Found,No
islamic azad university of mashhad,Others,Not Found,Not Found,No
islamic hospital,Error,Error,Error,Error
islamic international dental hospital,Others,Not Found,Not Found,No
island pharmaceuticals ltd,Biotechnology,"$2.4M, Post IPO equity",https://au.linkedin.com/company/island-pharmaceuticals,No
israel institute of technology,Others,Not Found,Not Found,Yes
istanbul aydin university,Others,Not Found,Not Found,No
istanbul faculty of medicine,Error,Error,Error,Error
istanbul gelisim university,Others,Not Found,Not Found,No
istanbul medipol university,Others,Not Found,Not Found,No
istanbul new century university,Others,Not Found,Not Found,No
istanbul physical therapy rehabilitation training and research hospital,Others,Not Found,Not Found,No
istesso ltd,Biotechnology,Not Found,Not Found,No
istituti fisioterapici ospitalieri,Biotechnology,Not Found,Not Found,No
istituti tumori giovanni paolo ii,Others,Not Found,Not Found,No
istituto clinico sant''ambrogio,Others,Not Found,Not Found,Yes
istituto ganassini spa,Pharmaceuticals,Not Found,Not Found,No
istituto giannina gaslini,Others,Not Found,Not Found,No
istituto nazinonale tumori,Others,Not Found,Not Found,No
istituto nazionale di ricovero e cura per anziani,Others,Not Found,Not Found,No
istituto ortopedico gaetano pini,Others,Not Found,Not Found,No
italfarmaco holding spa,Pharmaceuticals,Not Found,Not Found,Yes
italfarmaco spa,Pharmaceuticals,Not Found,Not Found,Yes
